subject_name,class_level_name,topic_title,question_text,question_type,correct_answer,explanation,difficulty,points,time_limit,choice_a,choice_b,choice_c,choice_d
English Language,Basic 9,Critical Thinking,What does it mean to analyze a text?,multiple_choice,b,Analysis involves breaking down a text to examine its parts and understand how they work together.,medium,10,75,To read it quickly,To examine it carefully and break it down,To memorize it,To copy it exactly
English Language,Basic 9,Critical Thinking,What is bias in writing?,multiple_choice,c,Bias is when a writer shows unfair preference for one side of an issue.,medium,10,75,Writing very quickly,Using difficult words,Showing unfair preference for one side,Writing long sentences
English Language,Basic 9,Critical Thinking,What should you do when evaluating sources?,multiple_choice,d,When evaluating sources you should check their credibility accuracy and reliability.,medium,10,90,Believe everything you read,Use only the first source you find,Choose sources that agree with you,Check credibility and accuracy
English Language,Basic 9,Critical Thinking,What is the difference between primary and secondary sources?,multiple_choice,a,Primary sources are original firsthand accounts while secondary sources analyze or interpret primary sources.,hard,15,90,Primary sources are original; secondary sources analyze them,Primary sources are newer; secondary sources are older,Primary sources are longer; secondary sources are shorter,There is no difference
English Language,Basic 9,Critical Thinking,What does it mean to synthesize information?,multiple_choice,b,Synthesizing means combining information from multiple sources to create new understanding.,hard,15,90,To copy information exactly,To combine information from multiple sources,To delete unnecessary information,To translate information
English Language,Basic 9,Critical Thinking,What is a logical fallacy?,multiple_choice,c,A logical fallacy is an error in reasoning that makes an argument invalid.,hard,15,90,A type of logic puzzle,A mathematical error,An error in reasoning,A writing technique
English Language,Basic 9,Critical Thinking,What does 'drawing conclusions' mean?,multiple_choice,d,Drawing conclusions means making judgments based on evidence and reasoning.,medium,10,75,Making pictures,Writing an ending,Copying information,Making judgments based on evidence
English Language,Basic 9,Critical Thinking,What is the purpose of asking questions while reading?,multiple_choice,a,Asking questions helps you think more deeply and understand the text better.,medium,10,75,To help you think more deeply about the text,To slow down your reading,To confuse yourself,To impress others
English Language,Basic 9,Critical Thinking,What does it mean to make connections while reading?,multiple_choice,b,Making connections means linking the text to your experiences other texts or the world.,medium,10,90,To connect sentences with conjunctions,To link the text to your experiences and knowledge,To connect with the author,To join reading groups
English Language,Basic 9,Critical Thinking,What is the difference between fact and inference?,multiple_choice,c,Facts are directly stated while inferences are conclusions drawn from evidence.,medium,10,75,Facts are false; inferences are true,Facts are opinions; inferences are facts,Facts are stated; inferences are conclusions drawn,There is no difference
English Language,Basic 9,Media Literacy,What is the main purpose of advertising?,multiple_choice,b,The primary purpose of advertising is to persuade people to buy products or services.,easy,10,60,To inform people,To persuade people to buy something,To entertain people,To educate people
English Language,Basic 9,Media Literacy,What should you consider when viewing online content?,multiple_choice,d,When viewing online content you should always consider the source's credibility and reliability.,medium,10,75,Only the entertainment value,Only the length of the content,Only the pictures used,The credibility of the source
English Language,Basic 9,Media Literacy,What is propaganda?,multiple_choice,c,Propaganda is information designed to promote a particular political cause or point of view.,medium,10,75,Factual news reporting,Entertainment content,Information designed to promote a cause,Educational material
English Language,Basic 9,Media Literacy,Why is it important to check multiple sources?,multiple_choice,a,Checking multiple sources helps you get a more complete and accurate picture of events.,medium,10,90,To get a more complete and accurate picture,To waste time,To confuse yourself,To find contradictions
English Language,Basic 9,Media Literacy,What is clickbait?,multiple_choice,b,Clickbait uses sensational headlines to attract clicks often misleading readers.,medium,10,75,High-quality journalism,Sensational headlines designed to attract clicks,Educational content,Government information
English Language,Basic 9,Media Literacy,What does 'going viral' mean in social media?,multiple_choice,d,'Going viral' means content spreads rapidly and widely across the internet.,medium,10,60,Getting a computer virus,Becoming sick,Being deleted,Spreading rapidly across the internet
English Language,Basic 9,Media Literacy,What is digital footprint?,multiple_choice,a,Digital footprint refers to the trail of data you leave when using the internet.,medium,10,75,The trail of data you leave online,The size of your computer screen,Your internet speed,Your typing skills
English Language,Basic 9,Media Literacy,Why should you be careful about sharing personal information online?,multiple_choice,c,Sharing personal information online can lead to privacy violations and security risks.,medium,10,90,It's not important,Everyone does it,It can lead to privacy and security risks,It's required by law
English Language,Basic 9,Media Literacy,What is fake news?,multiple_choice,b,Fake news is false or misleading information presented as legitimate news.,medium,10,75,News about celebrities,False or misleading information presented as news,Old news stories,International news
English Language,Basic 9,Media Literacy,What should you do before sharing information on social media?,multiple_choice,d,You should always verify that information is accurate before sharing it with others.,medium,10,75,Share it immediately,Add your opinion,Make it more interesting,Verify that it's accurate
English Language,Basic 9,Study Skills,What is the most effective way to take notes?,multiple_choice,c,Using your own words and organizing information helps you understand and remember better.,medium,10,75,Copy everything word for word,Write as fast as possible,Use your own words and organize information,Don't take notes at all
English Language,Basic 9,Study Skills,What is the purpose of summarizing?,multiple_choice,a,Summarizing helps you identify and remember the main ideas of a text.,medium,10,60,To identify and remember main ideas,To make the text longer,To copy the author's style,To avoid reading the full text
English Language,Basic 9,Study Skills,When is the best time to review your notes?,multiple_choice,b,Reviewing notes soon after taking them helps transfer information to long-term memory.,medium,10,75,Never,Soon after taking them,Only before exams,A year later
English Language,Basic 9,Study Skills,What is active reading?,multiple_choice,d,Active reading involves engaging with the text through questioning predicting and connecting.,medium,10,90,Reading very fast,Reading out loud,Reading while walking,Engaging with the text through questioning and connecting
English Language,Basic 9,Study Skills,What is the SQ3R study method?,multiple_choice,c,SQ3R stands for Survey Question Read Recite Review - a systematic study approach.,hard,15,90,A type of test,A reading speed technique,Survey Question Read Recite Review,A note-taking method
English Language,Basic 9,Study Skills,What should you do if you don't understand something while reading?,multiple_choice,a,When you don't understand something you should stop and reread or ask for help.,medium,10,75,Stop and reread or ask for help,Skip it and continue,Guess the meaning,Give up reading
English Language,Basic 9,Study Skills,What is the benefit of creating mind maps?,multiple_choice,b,Mind maps help visualize connections between ideas and concepts.,medium,10,75,They look pretty,They help visualize connections between ideas,They take up space,They're required for all subjects
English Language,Basic 9,Study Skills,How can you improve your concentration while studying?,multiple_choice,d,Eliminating distractions helps you focus better on your studies.,medium,10,60,Study with loud music,Study in a crowded place,Keep your phone nearby,Eliminate distractions
English Language,Basic 9,Study Skills,What is the purpose of setting study goals?,multiple_choice,a,Setting goals helps you stay focused and motivated in your studies.,medium,10,60,To stay focused and motivated,To impress teachers,To compete with others,To waste time
English Language,Basic 9,Study Skills,What should you do after completing a study session?,multiple_choice,c,Reviewing what you learned helps reinforce the information in your memory.,medium,10,60,Immediately start the next subject,Take a very long break,Review what you learned,Forget about it completely
English Language,Basic 9,Formal and Informal Language,Which is an example of formal language?,multiple_choice,a,'I would like to request' is formal language appropriate for official situations.,medium,10,60,I would like to request your assistance,Can you help me out?,Give me a hand,Help me
English Language,Basic 9,Formal and Informal Language,When should you use informal language?,multiple_choice,c,Informal language is appropriate when talking with friends and family in casual settings.,easy,10,45,In job interviews,In official letters,With friends and family,In academic essays
English Language,Basic 9,Formal and Informal Language,Which greeting is most formal?,multiple_choice,d,'Dear Sir/Madam' is the most formal greeting used in official correspondence.,medium,10,60,Hi there,Hey,Hello,Dear Sir/Madam
English Language,Basic 9,Formal and Informal Language,What is the formal equivalent of 'kids'?,multiple_choice,b,'Children' is the formal term while 'kids' is informal.,easy,10,45,Youngsters,Children,Little ones,Tots
English Language,Basic 9,Formal and Informal Language,Which closing is appropriate for a formal letter?,multiple_choice,c,'Yours sincerely' is a standard formal letter closing.,medium,10,60,See you later,Cheers,Yours sincerely,Bye
English Language,Basic 9,Formal and Informal Language,What makes language formal?,multiple_choice,d,Formal language uses complete sentences proper grammar and avoids contractions and slang.,medium,10,90,Using slang,Using contractions,Being very brief,Using complete sentences and proper grammar
English Language,Basic 9,Formal and Informal Language,Which sentence is more formal?,multiple_choice,a,'I cannot attend' is more formal than the contracted 'I can't attend'.,medium,10,60,I cannot attend the meeting,I can't come to the meeting,I won't be there,I'm not coming
English Language,Basic 9,Formal and Informal Language,In which situation would you use formal language?,multiple_choice,b,Job applications require formal language to show professionalism and respect.,medium,10,75,Texting friends,Writing a job application,Talking to siblings,Posting on social media
English Language,Basic 9,Formal and Informal Language,What is the formal way to say 'a lot of'?,multiple_choice,c,'Many' or 'much' are more formal than 'a lot of'.,medium,10,60,Loads of,Tons of,Many,Heaps of
English Language,Basic 9,Formal and Informal Language,Which is an example of informal language?,multiple_choice,d,'Gonna' is a contraction of 'going to' and is considered informal.,easy,10,45,I shall attend,I will be present,I plan to participate,I'm gonna come
English Language,Basic 9,Register and Style,What is register in language?,multiple_choice,b,Register refers to the level of formality used in different situations.,medium,10,75,The speed of speaking,The level of formality used,The volume of voice,The accent used
English Language,Basic 9,Register and Style,Which register would you use with your teacher?,multiple_choice,c,Teachers should be addressed with formal or semi-formal register showing respect.,medium,10,60,Very informal,Casual,Formal,Slang
English Language,Basic 9,Register and Style,What affects your choice of register?,multiple_choice,d,Register choice depends on your audience the situation and your relationship with listeners.,medium,10,90,Only your mood,Only the time of day,Only the location,Your audience and the situation
English Language,Basic 9,Register and Style,Which style is appropriate for academic writing?,multiple_choice,a,Academic writing requires formal objective style with proper grammar and vocabulary.,medium,10,75,Formal and objective,Casual and personal,Emotional and subjective,Humorous and light
English Language,Basic 9,Register and Style,What is colloquial language?,multiple_choice,c,Colloquial language is informal everyday speech used in casual conversation.,medium,10,75,Very formal language,Technical language,Informal everyday language,Foreign language
English Language,Basic 9,Register and Style,When might you use technical register?,multiple_choice,b,Technical register is used when discussing specialized topics with experts in the field.,medium,10,90,When talking to children,When discussing specialized topics with experts,When telling jokes,When writing poetry
English Language,Basic 9,Register and Style,What is jargon?,multiple_choice,d,Jargon consists of specialized terms used by people in specific professions or groups.,medium,10,75,Everyday language,Formal language,Foreign language,Specialized terms used by specific groups
English Language,Basic 9,Register and Style,Which factor does NOT affect register choice?,multiple_choice,a,Your favorite color doesn't affect how formally or informally you should speak.,easy,10,60,Your favorite color,Your relationship with the audience,The purpose of communication,The setting or context
English Language,Basic 9,Register and Style,What is the difference between style and register?,multiple_choice,c,Register is about formality level while style is about how you express yourself.,hard,15,90,They are the same thing,Style is formal; register is informal,Register is formality level; style is expression method,Register is written; style is spoken
English Language,Basic 9,Register and Style,Which register is used in legal documents?,multiple_choice,d,Legal documents use very formal register with precise technical language.,medium,10,60,Informal,Casual,Semi-formal,Very formal
English Language,Basic 9,Proverbs and Sayings,What does the proverb 'A stitch in time saves nine' mean?,multiple_choice,b,This proverb means that fixing small problems early prevents bigger problems later.,medium,10,90,Sewing is important,Fixing problems early prevents bigger ones,Time is valuable,Nine is a lucky number
English Language,Basic 9,Proverbs and Sayings,What is the meaning of 'Don't count your chickens before they hatch'?,multiple_choice,c,This means don't assume something will happen before it actually does.,medium,10,90,Chickens are hard to count,Farming is difficult,Don't assume success before it happens,Eggs are fragile
English Language,Basic 9,Proverbs and Sayings,What does 'Actions speak louder than words' mean?,multiple_choice,a,This proverb means what you do is more important than what you say.,medium,10,75,What you do is more important than what you say,Speaking loudly is rude,Actions make noise,Words are quiet
English Language,Basic 9,Proverbs and Sayings,What is the meaning of 'The early bird catches the worm'?,multiple_choice,d,This proverb encourages being early or prompt to get the best opportunities.,medium,10,75,Birds eat worms,Morning is the best time,Worms come out early,Being early gives you advantages
English Language,Basic 9,Proverbs and Sayings,What does 'Don't put all your eggs in one basket' mean?,multiple_choice,b,This means don't risk everything on one option; spread your risks.,medium,10,90,Eggs break easily,Don't risk everything on one option,Baskets are unreliable,Shopping is dangerous
English Language,Basic 9,Proverbs and Sayings,What is the meaning of 'When in Rome do as the Romans do'?,multiple_choice,c,This means adapt to local customs and behaviors when in a new place.,medium,10,90,Romans are good examples,Travel is educational,Adapt to local customs,Rome is a great city
English Language,Basic 9,Proverbs and Sayings,What does 'A picture is worth a thousand words' mean?,multiple_choice,a,This means visual images can communicate more effectively than lengthy descriptions.,medium,10,75,Images communicate more than words,Pictures are expensive,Words are not important,Cameras are valuable
English Language,Basic 9,Proverbs and Sayings,What is the meaning of 'Better late than never'?,multiple_choice,d,This means it's better to do something late than not do it at all.,easy,10,60,Punctuality is not important,Late people are bad,Never is better than late,It's better to be late than not do it at all
English Language,Basic 9,Proverbs and Sayings,What does 'You can't judge a book by its cover' mean?,multiple_choice,b,This means you shouldn't judge people or things based only on appearance.,medium,10,75,Books have nice covers,Don't judge based on appearance only,Reading is important,Covers protect books
English Language,Basic 9,Proverbs and Sayings,What is the meaning of 'Practice makes perfect'?,multiple_choice,c,This proverb means that repeated practice leads to improvement and mastery.,easy,10,60,Perfection is impossible,Practice is boring,Repeated practice leads to improvement,Perfect people practice
English Language,Basic 9,Idioms and Expressions,What does 'break a leg' mean?,multiple_choice,b,'Break a leg' is an expression meaning 'good luck' especially before a performance.,medium,10,60,To injure yourself,Good luck,To dance badly,To run fast
English Language,Basic 9,Idioms and Expressions,What does 'it's raining cats and dogs' mean?,multiple_choice,c,This idiom means it's raining very heavily.,easy,10,45,Animals are falling,Pets are outside,It's raining very heavily,The weather is strange
English Language,Basic 9,Idioms and Expressions,What does 'spill the beans' mean?,multiple_choice,a,'Spill the beans' means to reveal a secret or tell something you weren't supposed to.,medium,10,75,To reveal a secret,To cook badly,To make a mess,To plant vegetables
English Language,Basic 9,Idioms and Expressions,What does 'bite the bullet' mean?,multiple_choice,d,'Bite the bullet' means to face a difficult situation with courage.,medium,10,75,To eat metal,To be angry,To shoot a gun,To face a difficult situation bravely
English Language,Basic 9,Idioms and Expressions,What does 'piece of cake' mean?,multiple_choice,b,'Piece of cake' means something is very easy to do.,easy,10,45,A dessert,Something very easy,A birthday party,Baking skills
English Language,Basic 9,Idioms and Expressions,What does 'hit the nail on the head' mean?,multiple_choice,c,This idiom means to be exactly right or accurate about something.,medium,10,75,To use a hammer,To hurt yourself,To be exactly right,To build something
English Language,Basic 9,Idioms and Expressions,What does 'let the cat out of the bag' mean?,multiple_choice,a,This expression means to accidentally reveal a secret.,medium,10,75,To accidentally reveal a secret,To free a pet,To go shopping,To clean house
English Language,Basic 9,Idioms and Expressions,What does 'burn the midnight oil' mean?,multiple_choice,d,'Burn the midnight oil' means to work or study late into the night.,medium,10,75,To waste fuel,To stay up partying,To light candles,To work late into the night
English Language,Basic 9,Idioms and Expressions,What does 'cost an arm and a leg' mean?,multiple_choice,b,This idiom means something is very expensive.,medium,10,60,To cause injury,To be very expensive,To require surgery,To be dangerous
English Language,Basic 9,Idioms and Expressions,What does 'kill two birds with one stone' mean?,multiple_choice,c,This means to accomplish two things with one action.,medium,10,75,To hunt birds,To be violent,To accomplish two things with one action,To throw stones
English Language,Basic 9,Poetry Analysis,What is the rhyme scheme of a poem that goes ABAB?,multiple_choice,a,ABAB means the first and third lines rhyme and the second and fourth lines rhyme.,medium,10,60,First and third lines rhyme; second and fourth lines rhyme,All lines rhyme,No lines rhyme,Only adjacent lines rhyme
English Language,Basic 9,Poetry Analysis,What is meter in poetry?,multiple_choice,c,Meter is the rhythmic pattern of stressed and unstressed syllables in verse.,medium,10,75,The length of the poem,The number of stanzas,The rhythmic pattern of syllables,The rhyme scheme
English Language,Basic 9,Poetry Analysis,What is a stanza?,multiple_choice,b,A stanza is a group of lines in a poem usually separated by a blank line.,easy,10,45,A single line in a poem,A group of lines in a poem,The title of a poem,The ending of a poem
English Language,Basic 9,Poetry Analysis,What is free verse?,multiple_choice,d,Free verse is poetry that doesn't follow regular patterns of rhyme or meter.,medium,10,75,Poetry about freedom,Very short poems,Poetry that costs nothing,Poetry without regular rhyme or meter
English Language,Basic 9,Poetry Analysis,What is the theme of a poem?,multiple_choice,a,The theme is the central message or main idea the poet wants to convey.,medium,10,60,The central message or main idea,The rhyme scheme,The number of lines,The poet's name
English Language,Basic 9,Poetry Analysis,What is imagery in poetry?,multiple_choice,c,Imagery uses descriptive language to create vivid mental pictures for readers.,medium,10,75,Pictures in a poetry book,The poet's imagination,Descriptive language that creates mental pictures,Rhyming words
English Language,Basic 9,Poetry Analysis,What is a sonnet?,multiple_choice,b,A sonnet is a 14-line poem usually written in iambic pentameter.,hard,15,90,A 10-line poem,A 14-line poem,A 16-line poem,A poem with no set length
English Language,Basic 9,Poetry Analysis,What is the mood of a poem?,multiple_choice,d,Mood is the emotional atmosphere or feeling created by the poem.,medium,10,60,The poet's attitude,The main character,The setting,The emotional atmosphere created
English Language,Basic 9,Poetry Analysis,What is alliteration in poetry?,multiple_choice,a,Alliteration is the repetition of consonant sounds at the beginning of words.,medium,10,60,Repetition of consonant sounds at word beginnings,Repetition of vowel sounds,Words that rhyme,Repetition of whole words
English Language,Basic 9,Poetry Analysis,What is the difference between rhythm and rhyme?,multiple_choice,c,Rhythm is the beat or flow while rhyme is the similarity of sounds at line endings.,medium,10,90,They are the same thing,Rhythm is louder than rhyme,Rhythm is the beat; rhyme is similar sounds,Rhythm is for music; rhyme is for poetry
English Language,Basic 9,Drama and Theatre,What is a monologue?,multiple_choice,b,A monologue is a long speech by one character in a play.,medium,10,60,A conversation between two characters,A long speech by one character,The title of a play,The ending of a play
English Language,Basic 9,Drama and Theatre,What is dialogue in drama?,multiple_choice,a,Dialogue is the conversation between characters in a play.,easy,10,45,Conversation between characters,The narrator's voice,Stage directions,The audience's response
English Language,Basic 9,Drama and Theatre,What are stage directions?,multiple_choice,c,Stage directions are instructions for actors about movement and actions.,medium,10,75,Lines spoken by actors,The plot of the play,Instructions for actors about movement,The audience seating arrangement
English Language,Basic 9,Drama and Theatre,What is the climax of a play?,multiple_choice,d,The climax is the turning point or most intense moment in the play.,medium,10,60,The beginning,The middle,The end,The turning point or most intense moment
English Language,Basic 9,Drama and Theatre,What is a soliloquy?,multiple_choice,b,A soliloquy is when a character speaks their thoughts aloud usually alone on stage.,hard,15,90,A conversation between many characters,A character speaking thoughts aloud alone,The opening of a play,A type of stage
English Language,Basic 9,Drama and Theatre,What is the setting in drama?,multiple_choice,a,Setting is where and when the action of the play takes place.,easy,10,45,Where and when the action takes place,The main character,The conflict in the play,The moral of the story
English Language,Basic 9,Drama and Theatre,What is dramatic irony?,multiple_choice,c,Dramatic irony occurs when the audience knows something the characters don't.,hard,15,90,When actors forget their lines,When the play is funny,When the audience knows something characters don't,When the ending is sad
English Language,Basic 9,Drama and Theatre,What is a tragedy in drama?,multiple_choice,d,A tragedy is a serious play that usually ends with the downfall of the main character.,medium,10,75,A funny play,A short play,A play with music,A serious play ending in downfall
English Language,Basic 9,Drama and Theatre,What is the protagonist in a play?,multiple_choice,a,The protagonist is the main character around whom the story revolves.,easy,10,45,The main character,The villain,The narrator,The director
English Language,Basic 9,Drama and Theatre,What is an aside in drama?,multiple_choice,b,An aside is when a character speaks directly to the audience unheard by other characters.,medium,10,90,A conversation between characters,A character speaking directly to the audience,Stage directions,The intermission
