subject_name,class_level_name,topic_title,question_text,question_type,correct_answer,explanation,difficulty,points,time_limit,choice_a,choice_b,choice_c,choice_d
English Language,Basic 9,Comprehension Skills,What is the main idea of a paragraph?,multiple_choice,c,The main idea is the most important point or central message of the paragraph.,easy,10,60,The first sentence,The last sentence,The most important point or central message,The longest sentence
English Language,Basic 9,Comprehension Skills,What are supporting details?,multiple_choice,b,Supporting details provide evidence examples or explanations for the main idea.,medium,10,75,The main points of a text,Evidence and examples that support the main idea,Unimportant information,The conclusion of a text
English Language,Basic 9,Comprehension Skills,What is the purpose of making predictions while reading?,multiple_choice,a,Making predictions keeps you engaged and helps you understand the text better.,medium,10,75,To keep you engaged and understand better,To finish reading faster,To impress others,To avoid reading carefully
English Language,Basic 9,Comprehension Skills,What does it mean to visualize while reading?,multiple_choice,d,Visualizing means creating mental pictures of what you're reading about.,medium,10,60,To read very quickly,To read out loud,To take notes,To create mental pictures
English Language,Basic 9,Comprehension Skills,What is the difference between explicit and implicit information?,multiple_choice,c,Explicit information is directly stated while implicit information must be inferred.,medium,10,90,Explicit is hidden; implicit is obvious,They are the same thing,Explicit is stated; implicit is inferred,Explicit is important; implicit is not
English Language,Basic 9,Comprehension Skills,What should you do when you encounter an unfamiliar word?,multiple_choice,b,You should use context clues to try to understand the word's meaning.,medium,10,75,Skip it completely,Use context clues to understand it,Look it up immediately,Ask someone else
English Language,Basic 9,Comprehension Skills,What is the purpose of asking questions while reading?,multiple_choice,a,Asking questions helps you think critically and understand the text deeper.,medium,10,75,To think critically and understand deeper,To slow down your reading,To confuse yourself,To show off your knowledge
English Language,Basic 9,Comprehension Skills,What does it mean to make connections while reading?,multiple_choice,c,Making connections means linking what you read to your experiences and other knowledge.,medium,10,90,To connect sentences together,To connect with other readers,To link text to your experiences and knowledge,To connect paragraphs
English Language,Basic 9,Comprehension Skills,What is summarizing?,multiple_choice,d,Summarizing means restating the main points in your own words briefly.,medium,10,60,Copying the text exactly,Reading very quickly,Writing a long explanation,Restating main points briefly in your own words
English Language,Basic 9,Comprehension Skills,Why is it important to monitor your comprehension while reading?,multiple_choice,b,Monitoring comprehension helps you know when you understand and when you need help.,medium,10,90,To read faster,To know when you understand and when you need help,To impress teachers,To finish assignments quickly
