subject_name,class_level_name,topic_title,question_text,question_type,correct_answer,explanation,difficulty,points,time_limit,choice_a,choice_b,choice_c,choice_d
English Language,Basic 9,Grammar and Usage,Which sentence is grammatically correct?,multiple_choice,b,Subject-verb agreement: 'Each of the students has' is correct because 'each' is singular.,medium,10,60,Each of the students have submitted their work,Each of the students has submitted his work,Each of the students have submitted his work,Each of the students has submitted their work
English Language,Basic 9,Grammar and Usage,Choose the correct form of the verb: She _____ to school every day.,multiple_choice,a,'Goes' is the correct present tense form for third person singular.,easy,10,45,goes,go,going,gone
English Language,Basic 9,Grammar and Usage,Identify the type of sentence: 'What a beautiful day it is!',multiple_choice,c,This sentence expresses strong emotion or surprise making it an exclamatory sentence.,medium,10,60,Declarative,Interrogative,Exclamatory,Imperative
English Language,Basic 9,Grammar and Usage,Which word is a conjunction in this sentence: 'I will come if you invite me'?,multiple_choice,b,'If' is a subordinating conjunction that introduces a conditional clause.,medium,10,60,will,if,you,me
English Language,Basic 9,Grammar and Usage,Choose the correct pronoun: Between you and _____ this is a secret.,multiple_choice,a,'Me' is correct because it's the object of the preposition 'between'.,medium,10,60,me,I,myself,mine
English Language,Basic 9,Grammar and Usage,What is the past participle of 'write'?,multiple_choice,c,The past participle of 'write' is 'written' (write-wrote-written).,medium,10,45,wrote,writing,written,writes
English Language,Basic 9,Grammar and Usage,Identify the adverb in: 'She sang beautifully at the concert.',multiple_choice,d,'Beautifully' modifies the verb 'sang' describing how she sang.,easy,10,45,She,sang,concert,beautifully
English Language,Basic 9,Grammar and Usage,Which sentence uses the passive voice?,multiple_choice,b,In passive voice the subject receives the action. 'The book was read by John' is passive.,medium,10,75,John read the book,The book was read by John,John is reading the book,John will read the book
English Language,Basic 9,Grammar and Usage,Choose the correct comparative form: This book is _____ than that one.,multiple_choice,a,'More interesting' is the correct comparative form for multi-syllable adjectives.,medium,10,60,more interesting,most interesting,interestinger,interestingest
English Language,Basic 9,Grammar and Usage,What type of clause is underlined: 'The man WHO LIVES NEXT DOOR is a doctor'?,multiple_choice,c,This is a relative clause that provides additional information about 'the man'.,medium,10,75,Noun clause,Adverb clause,Relative clause,Independent clause
English Language,Basic 9,Vocabulary and Word Study,What does the prefix 'un-' mean in 'unhappy'?,multiple_choice,b,The prefix 'un-' means 'not' or indicates the opposite.,easy,10,45,very,not,again,before
English Language,Basic 9,Vocabulary and Word Study,Choose the synonym for 'enormous'.,multiple_choice,c,'Huge' has the same meaning as 'enormous' - both mean very large.,medium,10,60,tiny,small,huge,medium
English Language,Basic 9,Vocabulary and Word Study,What is the antonym of 'ancient'?,multiple_choice,d,'Modern' is the opposite of 'ancient' in terms of time period.,medium,10,60,old,historical,traditional,modern
English Language,Basic 9,Vocabulary and Word Study,Which word is spelled correctly?,multiple_choice,a,'Necessary' is the correct spelling with one 'c' and two 's' letters.,medium,10,60,necessary,neccessary,necesary,neccesary
English Language,Basic 9,Vocabulary and Word Study,What does the idiom 'break the ice' mean?,multiple_choice,c,'Break the ice' means to start a conversation or make people feel comfortable in a social situation.,medium,10,75,To break something frozen,To be very cold,To start a conversation,To end a relationship
English Language,Basic 9,Vocabulary and Word Study,Choose the word that best completes: The _____ of the mountain was covered in snow.,multiple_choice,b,'Peak' refers to the highest point or top of a mountain.,medium,10,60,bottom,peak,side,middle
English Language,Basic 9,Vocabulary and Word Study,What is the meaning of 'procrastinate'?,multiple_choice,d,'Procrastinate' means to delay or postpone doing something.,medium,10,75,To work quickly,To finish early,To plan ahead,To delay doing something
English Language,Basic 9,Vocabulary and Word Study,Which word has the same root as 'telephone'?,multiple_choice,a,'Telegraph' shares the root 'tele-' meaning 'distant' or 'far'.,hard,15,90,telegraph,microphone,phonics,elephant
English Language,Basic 9,Vocabulary and Word Study,What does 'bibliography' mean?,multiple_choice,c,'Bibliography' is a list of books and sources used in research or writing.,medium,10,75,A person's life story,A book about biology,A list of books and sources,A type of library
English Language,Basic 9,Vocabulary and Word Study,Choose the correct homophone: I can _____ the music from here.,multiple_choice,b,'Hear' means to perceive sound while 'here' refers to location.,easy,10,45,here,hear,hair,hare
English Language,Basic 9,Reading Comprehension,What is the main purpose of a topic sentence?,multiple_choice,a,A topic sentence introduces the main idea of a paragraph.,medium,10,60,To introduce the main idea of a paragraph,To conclude the paragraph,To provide examples,To ask questions
English Language,Basic 9,Reading Comprehension,When making inferences while reading you should...,multiple_choice,c,Inferences are made by combining information from the text with your own knowledge and experience.,medium,10,75,Only use information stated directly,Ignore the text completely,Use clues from the text and your knowledge,Make random guesses
English Language,Basic 9,Reading Comprehension,What is the difference between fact and opinion?,multiple_choice,b,Facts can be proven true or false while opinions are personal beliefs or judgments.,medium,10,75,Facts are always false; opinions are true,Facts can be proven; opinions are personal beliefs,Facts are opinions; opinions are facts,There is no difference
English Language,Basic 9,Reading Comprehension,The author's purpose in writing can be to...,multiple_choice,d,Authors write to inform (teach) persuade (convince) or entertain (amuse) readers.,medium,10,60,inform only,persuade only,entertain only,inform persuade or entertain
English Language,Basic 9,Reading Comprehension,What does 'context clues' mean?,multiple_choice,a,Context clues are hints in the surrounding text that help determine the meaning of unfamiliar words.,medium,10,75,Hints that help understand unfamiliar words,Pictures in a book,The title of a story,The author's name
English Language,Basic 9,Writing Skills,What should every paragraph have?,multiple_choice,c,Every paragraph should have a clear topic sentence that states the main idea.,medium,10,60,At least 10 sentences,Only facts,A clear topic sentence,Rhyming words
English Language,Basic 9,Writing Skills,In essay writing what comes after the introduction?,multiple_choice,b,The body paragraphs come after the introduction and contain the main content and supporting details.,easy,10,45,Conclusion,Body paragraphs,Bibliography,Title page
English Language,Basic 9,Writing Skills,What is the purpose of a thesis statement?,multiple_choice,a,A thesis statement presents the main argument or central idea of an essay.,medium,10,75,To state the main argument of an essay,To list all the topics,To provide examples,To conclude the essay
English Language,Basic 9,Writing Skills,Which transition word shows contrast?,multiple_choice,c,'However' is a transition word that indicates contrast or opposition between ideas.,medium,10,60,Furthermore,Additionally,However,Similarly
English Language,Basic 9,Writing Skills,What should you do before writing a first draft?,multiple_choice,d,Planning and organizing ideas through brainstorming or outlining helps create a better first draft.,medium,10,75,Edit for grammar,Check spelling,Write the conclusion,Plan and organize ideas
English Language,Basic 9,Literature and Poetry,What is the main character in a story called?,multiple_choice,a,The protagonist is the main character around whom the story revolves.,easy,10,45,Protagonist,Antagonist,Narrator,Author
English Language,Basic 9,Literature and Poetry,What is personification?,multiple_choice,c,Personification gives human characteristics to non-human things or objects.,medium,10,60,Comparing two things using 'like' or 'as',Exaggerating for effect,Giving human qualities to non-human things,Using the same sound repeatedly
English Language,Basic 9,Literature and Poetry,What is the setting of a story?,multiple_choice,b,Setting refers to when and where the story takes place.,easy,10,45,The main character,The time and place of the story,The problem in the story,The lesson learned
English Language,Basic 9,Literature and Poetry,What is a metaphor?,multiple_choice,d,A metaphor directly compares two things without using 'like' or 'as'.,medium,10,60,A comparison using 'like' or 'as',An exaggeration,A question that doesn't need an answer,A direct comparison without 'like' or 'as'
English Language,Basic 9,Literature and Poetry,What is the climax of a story?,multiple_choice,c,The climax is the turning point or most exciting moment in a story.,medium,10,75,The beginning of the story,The end of the story,The most exciting or turning point,The lesson of the story
English Language,Basic 9,Literature and Poetry,What is alliteration?,multiple_choice,a,Alliteration is the repetition of the same consonant sound at the beginning of words.,medium,10,60,Repetition of consonant sounds at word beginnings,Repetition of vowel sounds,Words that rhyme,Giving objects human qualities
English Language,Basic 9,Literature and Poetry,What is the theme of a literary work?,multiple_choice,b,Theme is the central message or main idea that the author wants to convey.,medium,10,75,The title of the work,The central message or main idea,The main character,The setting
English Language,Basic 9,Literature and Poetry,What is irony?,multiple_choice,d,Irony occurs when there's a contrast between expectation and reality or between appearance and truth.,hard,15,90,A type of rhyme,A character in a story,A writing technique,A contrast between expectation and reality
English Language,Basic 9,Literature and Poetry,What is a simile?,multiple_choice,a,A simile compares two things using 'like' or 'as'.,easy,10,45,A comparison using 'like' or 'as',A direct comparison,An exaggeration,A question
English Language,Basic 9,Literature and Poetry,What is the resolution of a story?,multiple_choice,c,The resolution is how the conflict is solved or the story ends.,medium,10,60,The beginning,The most exciting part,How the conflict is solved,The main character
English Language,Basic 9,Oral Communication,What is the most important aspect of effective speaking?,multiple_choice,b,Clear pronunciation ensures that the audience can understand what is being said.,medium,10,60,Speaking loudly,Clear pronunciation,Using big words,Speaking quickly
English Language,Basic 9,Oral Communication,When giving a presentation you should...,multiple_choice,a,Making eye contact with the audience helps establish connection and shows confidence.,medium,10,75,Make eye contact with the audience,Look at the floor,Read directly from notes,Speak very fast
English Language,Basic 9,Oral Communication,What is active listening?,multiple_choice,c,Active listening involves paying full attention and responding appropriately to the speaker.,medium,10,75,Listening to music,Hearing background noise,Paying full attention and responding,Ignoring the speaker
English Language,Basic 9,Oral Communication,Which is NOT a good public speaking technique?,multiple_choice,d,Speaking in a monotone voice makes presentations boring and hard to follow.,medium,10,60,Using gestures,Varying your voice,Making eye contact,Speaking in monotone
English Language,Basic 9,Oral Communication,What should you do if you make a mistake while speaking?,multiple_choice,b,Acknowledging the mistake briefly and continuing shows confidence and professionalism.,medium,10,75,Stop speaking immediately,Acknowledge it briefly and continue,Pretend it didn't happen,Start over completely
English Language,Basic 9,Punctuation and Mechanics,Where should the apostrophe go in "the students books"?,multiple_choice,a,Since there are multiple students the apostrophe goes after the 's': students'.,medium,10,60,students',student's,students's,No apostrophe needed
English Language,Basic 9,Punctuation and Mechanics,Which sentence is punctuated correctly?,multiple_choice,c,Items in a series should be separated by commas with 'and' before the last item.,medium,10,75,I bought apples oranges and bananas,I bought apples oranges; and bananas,I bought apples oranges and bananas,I bought apples; oranges; and bananas
English Language,Basic 9,Punctuation and Mechanics,When should you use a semicolon?,multiple_choice,b,Semicolons connect two related independent clauses that could stand alone as sentences.,hard,15,90,To end a sentence,To connect two related independent clauses,To separate items in a list,To show possession
English Language,Basic 9,Punctuation and Mechanics,Which sentence uses quotation marks correctly?,multiple_choice,a,The period goes inside the quotation marks in American English.,medium,10,75,She said "Hello.",She said "Hello".,She said "Hello.",She said "Hello".
English Language,Basic 9,Punctuation and Mechanics,What is the correct way to write the plural of 'child'?,multiple_choice,c,'Children' is the irregular plural form of 'child'.,easy,10,45,childs,childes,children,child's
English Language,Basic 9,Sentence Structure,What is a compound sentence?,multiple_choice,b,A compound sentence contains two or more independent clauses joined by a conjunction.,medium,10,75,A sentence with one independent clause,A sentence with two independent clauses,A sentence with a dependent clause,A very long sentence
English Language,Basic 9,Sentence Structure,Identify the subject in: 'The tall boy ran quickly.',multiple_choice,a,'The tall boy' is the complete subject with 'boy' being the simple subject.,easy,10,45,The tall boy,ran,quickly,boy
English Language,Basic 9,Sentence Structure,What is a fragment?,multiple_choice,c,A fragment is an incomplete sentence that lacks a subject verb or complete thought.,medium,10,60,A very short sentence,A very long sentence,An incomplete sentence,A question
English Language,Basic 9,Sentence Structure,Which is a complex sentence?,multiple_choice,d,A complex sentence has one independent clause and at least one dependent clause.,medium,10,90,I went home,I went home and ate dinner,I went home; I ate dinner,I went home because I was tired
English Language,Basic 9,Sentence Structure,What is a run-on sentence?,multiple_choice,b,A run-on sentence incorrectly joins two or more independent clauses without proper punctuation.,medium,10,75,A very long sentence,Two sentences incorrectly joined,A sentence with many adjectives,A sentence that doesn't make sense
English Language,Basic 9,Spelling and Phonics,Which word follows the 'i before e except after c' rule?,multiple_choice,a,'Believe' follows the rule: 'i' comes before 'e' when not after 'c'.,medium,10,60,believe,receive,weird,height
English Language,Basic 9,Spelling and Phonics,What is a silent letter in 'knife'?,multiple_choice,b,The 'k' in 'knife' is silent - it's not pronounced.,easy,10,45,n,k,i,f
English Language,Basic 9,Spelling and Phonics,Which word is spelled correctly?,multiple_choice,c,'Definitely' is often misspelled but the correct spelling has 'finite' in the middle.,medium,10,60,definately,definatly,definitely,definitly
English Language,Basic 9,Spelling and Phonics,What sound does 'ph' make in 'phone'?,multiple_choice,a,The digraph 'ph' makes the 'f' sound in English.,easy,10,45,f,p,ph,h
English Language,Basic 9,Spelling and Phonics,Which word has a long vowel sound?,multiple_choice,c,'Make' has a long 'a' sound while the others have short vowel sounds.,medium,10,60,cat,sit,make,dog
English Language,Basic 9,Comprehension Strategies,What should you do before reading a text?,multiple_choice,b,Previewing helps you understand what the text is about and prepares your mind for reading.,medium,10,60,Read it as fast as possible,Preview the title and headings,Skip to the end,Read every word carefully
English Language,Basic 9,Comprehension Strategies,What is skimming?,multiple_choice,a,Skimming means reading quickly to get the general idea or main points.,medium,10,60,Reading quickly for main ideas,Reading every word carefully,Reading only the first sentence,Reading backwards
English Language,Basic 9,Comprehension Strategies,When should you use scanning?,multiple_choice,c,Scanning is used when you're looking for specific information like dates names or facts.,medium,10,75,To understand the main idea,To read for pleasure,To find specific information,To memorize the text
English Language,Basic 9,Comprehension Strategies,What is the SQ3R method?,multiple_choice,d,SQ3R stands for Survey Question Read Recite Review - a systematic reading strategy.,hard,15,90,A type of question,A reading speed,A writing technique,Survey Question Read Recite Review
English Language,Basic 9,Comprehension Strategies,What should you do after reading?,multiple_choice,b,Summarizing helps consolidate understanding and remember key information.,medium,10,60,Forget about it,Summarize the main points,Read it again immediately,Copy it word for word
English Language,Basic 9,Creative Writing,What is the first step in creative writing?,multiple_choice,a,Brainstorming ideas helps generate creative content before you start writing.,medium,10,60,Brainstorming ideas,Writing the conclusion,Editing for grammar,Publishing the work
English Language,Basic 9,Creative Writing,What makes dialogue effective in a story?,multiple_choice,c,Effective dialogue sounds natural and reveals character while advancing the plot.,medium,10,75,Using big words,Making it very long,Making it sound natural,Using perfect grammar always
English Language,Basic 9,Creative Writing,What is 'show don't tell' in writing?,multiple_choice,b,'Show don't tell' means using descriptive details and actions rather than simply stating facts.,medium,10,90,Always use simple sentences,Use descriptive details instead of stating facts,Never use adjectives,Write very short paragraphs
English Language,Basic 9,Creative Writing,What is the purpose of a hook in writing?,multiple_choice,a,A hook grabs the reader's attention and makes them want to continue reading.,medium,10,60,To grab the reader's attention,To end the story,To provide facts,To list characters
English Language,Basic 9,Creative Writing,What should you consider when choosing a point of view?,multiple_choice,d,Point of view affects how much the narrator knows and how the story is told to readers.,medium,10,75,Only use first person,Always use third person,Never change point of view,How it affects the story and reader
English Language,Basic 9,Language Functions,What is the function of language in 'Could you please help me?'?,multiple_choice,b,This sentence is making a polite request for assistance.,medium,10,60,Giving information,Making a request,Expressing emotion,Describing something
English Language,Basic 9,Language Functions,Which sentence expresses an opinion?,multiple_choice,c,'I think' indicates that this is the speaker's personal opinion or belief.,easy,10,45,The sky is blue,Water boils at 100°C,I think pizza is delicious,There are 24 hours in a day
English Language,Basic 9,Language Functions,What is the function of 'Thank you very much'?,multiple_choice,a,This phrase expresses gratitude or appreciation.,easy,10,45,Expressing gratitude,Asking for help,Giving directions,Making a complaint
English Language,Basic 9,Language Functions,Which phrase is used to give advice?,multiple_choice,d,'You should' is commonly used to give advice or recommendations.,medium,10,60,I want,Can you,It is,You should
English Language,Basic 9,Language Functions,What is the function of 'I'm sorry to hear that'?,multiple_choice,b,This phrase expresses sympathy or empathy for someone's situation.,medium,10,60,Asking for information,Expressing sympathy,Making a request,Giving instructions
English Language,Basic 9,Figures of Speech,What figure of speech is used in 'The classroom was a zoo'?,multiple_choice,c,This is a metaphor because it directly compares the classroom to a zoo without using 'like' or 'as'.,medium,10,60,Simile,Personification,Metaphor,Alliteration
English Language,Basic 9,Figures of Speech,Identify the figure of speech: 'The wind whispered secrets through the trees.',multiple_choice,b,This is personification because the wind is given the human ability to whisper.,medium,10,75,Metaphor,Personification,Simile,Hyperbole
English Language,Basic 9,Figures of Speech,What is hyperbole?,multiple_choice,d,Hyperbole is deliberate exaggeration used for emphasis or dramatic effect.,medium,10,60,A direct comparison,Giving human qualities to objects,A comparison using like or as,Deliberate exaggeration for effect
English Language,Basic 9,Figures of Speech,'She sells seashells by the seashore' is an example of...,multiple_choice,a,This demonstrates alliteration with the repetition of the 's' sound.,easy,10,45,Alliteration,Metaphor,Simile,Onomatopoeia
English Language,Basic 9,Figures of Speech,What figure of speech is 'Buzz' 'Hiss' 'Bang'?,multiple_choice,d,These are examples of onomatopoeia - words that imitate sounds.,medium,10,60,Metaphor,Simile,Alliteration,Onomatopoeia
English Language,Basic 9,Figures of Speech,Identify the oxymoron in these phrases.,multiple_choice,b,'Deafening silence' combines contradictory terms making it an oxymoron.,hard,15,75,Pretty ugly,Deafening silence,Jumbo shrimp,All of the above
English Language,Basic 9,Figures of Speech,What is a rhetorical question?,multiple_choice,c,A rhetorical question is asked for effect and doesn't expect an answer.,medium,10,75,A very difficult question,A question about rhetoric,A question asked for effect not expecting an answer,A question with multiple answers
English Language,Basic 9,Figures of Speech,'I could eat a horse' is an example of...,multiple_choice,a,This is hyperbole - an exaggeration to emphasize how hungry someone is.,medium,10,60,Hyperbole,Metaphor,Simile,Personification
English Language,Basic 9,Figures of Speech,What is an euphemism?,multiple_choice,d,A euphemism is a mild or indirect term used instead of a harsh or direct one.,hard,15,90,A type of poem,A comparison,A sound device,A mild term used instead of a harsh one
English Language,Basic 9,Figures of Speech,Identify the paradox: 'Less is more.',multiple_choice,c,A paradox is a statement that seems contradictory but reveals a deeper truth.,hard,15,75,It's not a paradox,It's a metaphor,It's a paradox,It's a simile
English Language,Basic 9,Text Types,What is the main purpose of a narrative text?,multiple_choice,a,Narrative texts are written primarily to tell a story or recount events.,easy,10,45,To tell a story,To give instructions,To persuade,To provide information
English Language,Basic 9,Text Types,Which text type would you use to explain how to bake a cake?,multiple_choice,b,Procedural texts provide step-by-step instructions for completing tasks.,medium,10,60,Narrative,Procedural,Persuasive,Descriptive
English Language,Basic 9,Text Types,What is the purpose of an argumentative essay?,multiple_choice,c,Argumentative essays aim to convince readers to accept a particular viewpoint.,medium,10,75,To tell a story,To describe something,To persuade or convince,To give instructions
English Language,Basic 9,Text Types,Which text type focuses on creating a mental picture?,multiple_choice,d,Descriptive texts use detailed language to help readers visualize or imagine something.,medium,10,60,Narrative,Procedural,Argumentative,Descriptive
English Language,Basic 9,Text Types,What is an expository text?,multiple_choice,b,Expository texts explain or inform readers about a topic using facts and information.,medium,10,75,A text that tells a story,A text that explains or informs,A text that persuades,A text that describes feelings
English Language,Basic 9,Text Types,Which feature is common in persuasive texts?,multiple_choice,c,Persuasive texts use emotional appeals to influence readers' feelings and decisions.,medium,10,75,Chronological order,Step-by-step instructions,Emotional appeals,Detailed descriptions
English Language,Basic 9,Text Types,What is a biography?,multiple_choice,a,A biography is a detailed account of someone else's life written by another person.,medium,10,60,A story about someone's life written by another person,A story about your own life,A fictional story,A poem about life
English Language,Basic 9,Text Types,Which text type would a newspaper editorial be?,multiple_choice,d,Editorials express opinions and try to persuade readers making them argumentative.,medium,10,75,Narrative,Descriptive,Expository,Argumentative
English Language,Basic 9,Text Types,What is the main characteristic of a diary entry?,multiple_choice,b,Diary entries are personal accounts written in first person about the writer's experiences.,medium,10,60,Written in third person,Personal and written in first person,Always fictional,Written for a large audience
English Language,Basic 9,Text Types,Which text type is a recipe?,multiple_choice,c,Recipes provide step-by-step instructions making them procedural texts.,easy,10,45,Narrative,Descriptive,Procedural,Argumentative
