subject_name,class_level_name,topic_title,question_text,question_type,correct_answer,explanation,difficulty,points,time_limit,choice_a,choice_b,choice_c,choice_d,,,,,,,,,,,,,,,,,,
Science,Basic 7,Plants and Animals,Which animal structure is responsible for filtering blood and producing urine?,multiple_choice,c,Kidneys are vital excretory organs.,easy,10,30,Liver,Stomach,Kidneys,Lungs,,,,,,,,,,,,,,,,,,
Science,Basic 7,Plants and Animals,What is the primary role of chlorophyll in plants?,multiple_choice,b,"Chlorophyll absorbs light energy, which is essential for photosynthesis.",easy,10,30,Transport water,Absorb light energy,Produce oxygen,Store food,,,,,,,,,,,,,,,,,,
Science,Basic 7,Plants and Animals,"Which body system involves the brain, spinal cord, and nerves?",multiple_choice,b,These are components of the nervous system.,easy,10,30,Circulatory system,Nervous system,Digestive system,Respiratory system,,,,,,,,,,,,,,,,,,
Science,Basic 7,Plants and Animals,What is an adaptation?,multiple_choice,a,An adaptation is a feature that helps an organism survive and reproduce in its environment.,easy,5,30,A feature that helps an organism survive,A change in weather,A type of food,A quick movement,,,,,,,,,,,,,,,,,,
Science,Basic 7,Plants and Animals,Which of the following is an example of a behavioral adaptation?,multiple_choice,d,Migration is a behavior animals exhibit to cope with environmental changes.,medium,10,45,Thick fur on a bear,Sharp claws of a lion,Gills of a fish,Birds migrating south for winter,,,,,,,,,,,,,,,,,,
Science,Basic 7,Plants and Animals,What is the primary concept behind natural selection?,multiple_choice,b,Natural selection proposes that individuals best adapted to their environment are more likely to survive and reproduce.,hard,15,90,All individuals in a population survive equally well,Individuals best suited to their environment survive and reproduce more,Organisms choose their adaptations,Environmental changes do not affect species,,,,,,,,,,,,,,,,,,
Science,Basic 7,Plants and Animals,Over long periods, changes in the inherited traits of a population are called?,multiple_choice,c,Evolution refers to the gradual change in the characteristics of a population over generations.,easy,5,30,Growth,Development,Evolution,,,,,,,,,,,,,,,,,,
Science,Basic 7,Plants and Animals,Why do cacti have thick, waxy stems and spines instead of broad leaves?,multiple_choice,b,These adaptations help cacti conserve water in dry desert environments.,medium,10,60,To attract insects,To conserve water,To grow taller,,,,,,,,,,,,,,,,,,
Science,Basic 7,Plants and Animals,Which of these animals would likely have webbed feet as an adaptation?,multiple_choice,a,Webbed feet are an adaptation for swimming.,easy,5,30,Duck,Cat,Dog,Lizard,,,,,,,,,,,,,,,,,,
Science,Basic 7,Plants and Animals,What is camouflage an example of?,multiple_choice,b,Camouflage is a physical adaptation that helps an animal blend into its surroundings.,medium,10,45,Behavioral adaptation,Structural adaptation,Physiological adaptation,Reproductive adaptation,,,,,,,,,,,,,,,,,,
Science,Basic 7,Plants and Animals,Why do some animals hibernate during winter?,multiple_choice,c,Hibernation is a behavioral adaptation to conserve energy during periods of cold and food scarcity.,medium,10,60,To find food,To reproduce,To conserve energy in cold weather,To escape predators,,,,,,,,,,,,,,,,,,
Science,Basic 7,Plants and Animals,The gradual process by which living things change to become better suited to their environment is called?,multiple_choice,a,Adaptation is the process of becoming adjusted to new conditions.,easy,5,30,Adaptation,Migration,Metamorphosis,Symbiosis,,,,,,,,,,,,,,,,,,
Science,Basic 7,Plants and Animals,What is the name of the scientist credited with developing the theory of evolution by natural selection?,multiple_choice,d,Charles Darwin proposed the theory of evolution by natural selection.,easy,5,30,Albert Einstein,Isaac Newton,Marie Curie,Charles Darwin,,,,,,,,,,,,,,,,,,
Science,Basic 7,Plants and Animals,Which adaptation would help a desert animal survive in hot, dry conditions?,multiple_choice,a,Nocturnal activity helps avoid extreme daytime heat.,medium,10,45,Being nocturnal,Having thick fur,Having large ears for cooling,,,,,,,,,,,,,,,,,,
Science,Basic 7,Plants and Animals,Why might a bird species develop a long, slender beak?,multiple_choice,c,Beak shape is often adapted for specific food sources, like reaching nectar in flowers.,hard,15,75,To catch fish,To crack nuts,,,,,,,,,,,,,,,,,,
Science,Basic 7,Plants and Animals,What is mimicry?,multiple_choice,b,Mimicry is an adaptation where one species evolves to resemble another for protection or to hunt.,medium,10,60,An animal changing color,An animal hiding from predators,One species resembling another for survival,An animal migrating,,,,,,,,,,,,,,,,,,
Science,Basic 7,Plants and Animals,Which of these is a physiological adaptation?,multiple_choice,a,Controlling body temperature (thermoregulation) is a internal body process adaptation.,hard,15,90,Producing venom,Running fast,Having sharp teeth,Building a nest,,,,,,,,,,,,,,,,,,
Science,Basic 7,Plants and Animals,How does having a streamlined body shape help aquatic animals like fish?,multiple_choice,c,A streamlined body reduces drag, allowing faster and more efficient movement through water.,medium,10,45,To absorb more sunlight,To attract mates,To move easily through water,,,,,,,,,,,,,,,,,,
Science,Basic 7,Plants and Animals,What drives the process of natural selection?,multiple_choice,b,Competition for resources,predation,disease, and environmental changes are selective pressures.,hard,15,90,Random mutations only,,,,,,,,,,,,,,,,,,
Science,Basic 7,Plants and Animals,Which structural adaptation helps polar bears survive in cold environments?,multiple_choice,a,Thick blubber provides insulation and energy storage.,easy,5,30,Thick blubber,Long neck,Large ears,Webbed feet,,,,,,,,,,,,,,,,,,
Science,Basic 7,Plants and Animals,If a population of rabbits develops resistance to a certain disease over generations, this is an example of?,multiple_choice,d,This is an example of evolution through natural selection.,medium,10,60,Extinction,Hybridization,Domestication,,,,,,,,,,,,,,,,,,
Science,Basic 7,Plants and Animals,What is a common adaptation for plants living in nutrient-poor soils?,multiple_choice,b,Carnivorous plants trap and digest insects to obtain nutrients missing from the soil.,hard,15,75,Large leaves,Carnivorous traits,Deep roots only,Brightly colored flowers,,,,,,,,,,,,,,,,,,
Science,Basic 7,Plants and Animals,What is the term for a group of organisms that can interbreed and produce fertile offspring?,multiple_choice,a,This is the biological definition of a species.,easy,5,30,Species,Population,Community,Ecosystem,,,,,,,,,,,,,,,,,,
Science,Basic 7,Plants and Animals,Why do some animals have large eyes and good night vision?,multiple_choice,c,This is an adaptation for hunting or surviving in low-light conditions.,medium,10,45,To see in bright sunlight,To attract mates,To see effectively at night,To detect vibrations,,,,,,,,,,,,,,,,,,
Science,Basic 7,Plants and Animals,The process where organisms that are better adapted to their environment tend to survive and produce more offspring is called?,multiple_choice,b,This is the core concept of natural selection.,medium,10,60,Artificial selection,Natural selection,Genetic engineering,Mutation,,,,,,,,,,,,,,,,,,
Science,Basic 7,Plants and Animals,Which of the following is a physical adaptation of a camel to its desert environment?,multiple_choice,c,Camels have long eyelashes and nostrils that can close to keep sand out.,medium,10,45,Digging burrows,Migrating,Long eyelashes and ability to close nostrils,Drinking a lot of water daily,,,,,,,,,,,,,,,,,,
Science,Basic 7,Plants and Animals,What are homologous structures in the context of evolution?,multiple_choice,a,Homologous structures are similar structures in different species that originated from a common ancestor, even if they have different functions.,hard,15,90,Structures with similar origin but different function,Structures with different origin but similar function,Structures found only in extinct species,,,,,,,,,,,,,,,,,,
Science,Basic 7,Plants and Animals,A plant that closes its leaves during the day to reduce water loss is exhibiting what type of adaptation?,multiple_choice,b,This is a behavioral response to environmental conditions.,medium,10,60,Structural adaptation,Behavioral adaptation,Physiological adaptation,Genetic adaptation,,,,,,,,,,,,,,,,,,
Science,Basic 7,Plants and Animals,What is the primary role of a bird's feathers for survival?,multiple_choice,a,Feathers provide insulation and enable flight.,easy,5,30,Insulation and flight,Digging for food,Attracting mates,Warning predators,,,,,,,,,,,,,,,,,,
Science,Basic 7,Plants and Animals,Which of the following is an example of an animal adapting to its environment by changing its body temperature internally?,multiple_choice,c,Hibernation involves physiological changes like lowered body temperature and metabolism.,hard,15,90,Camouflage of a chameleon,Migration of birds,Hibernation of a bear,Building a nest by a bird,,,,,,,,,,,,,,,,,,
Science,Basic 7,Plants and Animals,"What does ""survival of the fittest"" mean in the context of natural selection?",multiple_choice,a,It means organisms best suited to their environment are more likely to survive and reproduce.,medium,10,60,Organisms best suited to their environment survive and reproduce,Only the strongest physically survive,Only the fastest individuals survive,All organisms survive equally well,,,,,,,,,,,,,,,,,,
Science,Basic 7,Plants and Animals,Why do some animals in cold regions have thick layers of blubber or fat?,multiple_choice,d,Blubber provides insulation against cold and stores energy.,easy,5,30,To help them swim faster,To make them heavier,To attract mates,To insulate them from cold,,,,,,,,,,,,,,,,,,
Science,Basic 7,Plants and Animals,Which type of adaptation involves changes in an organism's body structure?,multiple_choice,b,Structural adaptations are physical features.,medium,10,45,Behavioral adaptation,Structural adaptation,Physiological adaptation,Genetic adaptation,,,,,,,,,,,,,,,,,,
Science,Basic 7,Plants and Animals,The long neck of a giraffe is an adaptation for?,multiple_choice,a,A long neck allows giraffes to reach leaves high up in trees.,easy,5,30,Reaching high leaves,Running fast,Drinking water easily,Hiding from predators,,,,,,,,,,,,,,,,,,
Science,Basic 7,Plants and Animals,Which of the following is a behavioral adaptation to escape predators?,multiple_choice,d,Playing dead (thanatosis) is a defensive behavior.,medium,10,45,Sharp claws,Thick skin,Venom production,Playing dead,,,,,,,,,,,,,,,,,,
Science,Basic 7,Plants and Animals,What is the process by which a population of organisms changes over generations due to natural selection?,multiple_choice,b,This is the definition of evolution.,medium,10,45,Growth,Evolution,Development,Metamorphosis,,,,,,,,,,,,,,,,,,
Science,Basic 7,Plants and Animals,Why do some plants in dry climates have small, needle-like leaves?,multiple_choice,c,Small leaves and needles reduce the surface area for water loss through transpiration.,hard,15,75,To attract insects,To store water,To reduce water loss,,,,,,,,,,,,,,,,,,
Science,Basic 7,Plants and Animals,Which of the following is an example of a physiological adaptation?,multiple_choice,d,A snake's venom is a physiological adaptation as it involves biochemical processes within the body.,hard,15,90,Mimicry,Camouflage,Hibernation,Producing venom,,,,,,,,,,,,,,,,,,
Science,Basic 7,Plants and Animals,If all individuals in a population were genetically identical, how would this affect their ability to adapt to a changing environment?,multiple_choice,b,Lack of variation means less raw material for natural selection to act upon, making adaptation difficult.,hard,15,90,They would adapt faster,They would have less ability to adapt,,,,,,,,,,,,,,,,,,
Science,Basic 7,Plants and Animals,What is the term for similar structures in different species that suggest a common ancestor, even if they have different functions?,multiple_choice,a,Homologous structures indicate shared ancestry.,medium,10,60,Homologous structures,Analogous structures,Vestigial structures,,,,,,,,,,,,,,,,,,
Science,Basic 7,Plants and Animals,What is the main role of fur or feathers in animals living in cold climates?,multiple_choice,b,They trap air, providing insulation.,easy,5,30,To provide camouflage,To provide insulation,To help them swim,,,,,,,,,,,,,,,,,,
Science,Grade 7,Reproduction,What is reproduction?,multiple_choice,a,Reproduction is the process by which living things produce offspring of their own kind.,easy,10,60,The process of producing offspring,Growing larger,Finding food,Moving from place to place,,,,,,,,,,,,,,,,,,
Science,Grade 7,Reproduction,What is the difference between sexual and asexual reproduction?,multiple_choice,b,Sexual reproduction requires two parents while asexual reproduction requires only one parent.,medium,10,90,No difference,Sexual needs two parents; asexual needs one,Sexual is faster,Asexual produces more offspring,,,,,,,,,,,,,,,,,,
Science,Grade 7,Reproduction,What is metamorphosis?,multiple_choice,c,Metamorphosis is the process of transformation from one life stage to another like caterpillar to butterfly.,medium,10,75,Growing bigger,Changing color,Transformation from one life stage to another,Moving to a new place,,,,,,,,,,,,,,,,,,
Science,Grade 7,Reproduction,Which animals undergo complete metamorphosis?,multiple_choice,a,Butterflies undergo complete metamorphosis: egg → larva → pupa → adult.,medium,10,75,Butterflies,Dogs,Fish,Birds,,,,,,,,,,,,,,,,,,
Science,Grade 7,Reproduction,What is pollination?,multiple_choice,d,Pollination is the transfer of pollen from male to female parts of flowers enabling reproduction.,medium,10,90,Plants growing,Flowers opening,Seeds sprouting,Transfer of pollen between flower parts,,,,,,,,,,,,,,,,,,
Science,Basic 7,Reproduction,What is the main purpose of reproduction in living organisms?,multiple_choice,b,Reproduction ensures the continuity of the species.,easy,5,30,To grow larger,To obtain food,To ensure continuity of the species,To protect themselves,,,,,,,,,,,,,,,,,,
Science,Basic 7,Reproduction,Which type of reproduction involves two parents and leads to genetic variation in offspring?,multiple_choice,a,Sexual reproduction involves the fusion of gametes from two parents, leading to diverse offspring.,medium,10,45,Sexual reproduction,Asexual reproduction,Budding,,,,,,,,,,,,,,,,,,
Science,Basic 7,Reproduction,Which part of a plant is responsible for producing seeds?,multiple_choice,c,The flower is the reproductive organ of flowering plants, where seeds are formed.,easy,5,30,Stem,Leaf,Flower,,,,,,,,,,,,,,,,,,
Science,Basic 7,Reproduction,What is the process by which a sperm cell unites with an egg cell?,multiple_choice,d,Fertilization is the fusion of male and female gametes.,easy,5,30,Pollination,Germination,Growth,Fertilization,,,,,,,,,,,,,,,,,,
Science,Basic 7,Reproduction,The life cycle of a butterfly involves several stages. What is the correct order of these stages?,multiple_choice,c,Egg → Larva (caterpillar) → Pupa (chrysalis) → Adult butterfly.,medium,10,60,Larva, Egg, Pupa, Adult,,,,,,,,,,,,,,,,,,
Science,Basic 7,Reproduction,Which of the following animals undergoes complete metamorphosis?,multiple_choice,b,Butterflies undergo complete metamorphosis (egg, larva, pupa, adult). Grasshoppers undergo incomplete metamorphosis.,medium,10,45,Grasshopper,,,,,,,,,,,,,,,,,,
Science,Basic 7,Reproduction,In humans, where does the development of the fetus primarily occur?,multiple_choice,a,The fetus develops inside the uterus of the mother.,easy,5,30,Uterus,Ovary,Testis,,,,,,,,,,,,,,,,,,
Science,Basic 7,Reproduction,What is the transfer of pollen from the anther to the stigma of a flower called?,multiple_choice,b,Pollination is the transfer of pollen, a crucial step in plant reproduction.,easy,5,30,Fertilization,Pollination,Germination,,,,,,,,,,,,,,,,,,
Science,Basic 7,Reproduction,Which of these is an advantage of asexual reproduction?,multiple_choice,c,Asexual reproduction allows for rapid multiplication without needing a partner.,medium,10,60,Genetic variation,Requires two parents,Rapid multiplication,Increased adaptability,Metamorphosis,,,,,,,,,,,,,,,,,
Science,Basic 7,Reproduction,What is the process where a seed begins to grow into a new plant?,multiple_choice,d,Germination is the process by which an organism grows from a seed or spore.,easy,5,30,Pollination,Fertilization,Dispersal,Germination,To produce more flowers,,,,,,,,,,,,,,,,,
Science,Basic 7,Reproduction,Which animal lays eggs that hatch into young ones?,multiple_choice,a,Birds are oviparous (egg-laying).,easy,5,30,Chicken,Dog,Cat,Cow,,,,,,,,,,,,,,,,,,
Science,Basic 7,Reproduction,What is the function of the placenta during human pregnancy?,multiple_choice,c,The placenta provides nutrients and oxygen to the fetus and removes waste products.,hard,15,90,Stores food for the mother,Produces hormones for the mother,Provides nutrients and removes waste for the fetus,Protects the mother from infections,,,,,,,,,,,,,,,,,,
Science,Basic 7,Reproduction,The process by which plants reproduce without seeds (e.g., from stems, leaves) is called?,multiple_choice,b,Vegetative propagation is a form of asexual reproduction in plants.,medium,10,60,Sexual reproduction,Vegetative propagation,,,,,,,,,,,,,,,,,,
Science,Basic 7,Reproduction,What is the larval stage of a frog called?,multiple_choice,a,A tadpole is the aquatic larval stage of a frog.,easy,5,30,Tadpole,Caterpillar,Maggot,Nymph,,,,,,,,,,,,,,,,,,
Science,Basic 7,Reproduction,Which type of reproduction typically produces offspring genetically identical to the parent?,multiple_choice,d,Asexual reproduction creates clones of the parent.,medium,10,45,Sexual reproduction,Internal fertilization,External fertilization,Asexual reproduction,,,,,,,,,,,,,,,,,,
Science,Basic 7,Reproduction,What is the role of nectar in a flower?,multiple_choice,c,Nectar attracts pollinators like bees and butterflies.,medium,10,45,To protect the seed,To support the stem,To attract pollinators,To perform photosynthesis,Having webbed feet,,,,,,,,,,,,,,,,,
Science,Basic 7,Reproduction,Which of the following is an example of budding as a method of reproduction?,multiple_choice,b,Yeast reproduces by budding.,hard,15,75,Bacteria dividing,Amoeba splitting,Yeast forming a new cell,A plant growing from a cutting,To reach nectar in deep flowers,To dig for worms,,,,,,,,,,,,,,,,
Science,Basic 7,Reproduction,What is the primary function of the fruit in a flowering plant?,multiple_choice,a,The fruit protects the seeds and aids in their dispersal.,medium,10,45,Seed protection and dispersal,Attracting pollinators,Producing pollen,Carrying out photosynthesis,,,,,,,,,,,,,,,,,,
Science,Basic 7,Reproduction,How do most fish reproduce?,multiple_choice,b,Most fish reproduce through external fertilization, where eggs and sperm are released into the water.,medium,10,60,Internal fertilization,External fertilization,Budding,,,,,,,,,,,,,,,,,,
Science,Basic 7,Reproduction,What is the main difference between complete and incomplete metamorphosis?,multiple_choice,d,Complete metamorphosis has a pupa stage, while incomplete metamorphosis does not.,hard,15,90,Number of eggs laid,Size of the adult,Habitat of the young,To camouflage,,,,,,,,,,,,,,,,,
Science,Basic 7,Reproduction,Which human reproductive organ produces sperm?,multiple_choice,a,The testes are the male reproductive organs that produce sperm.,easy,5,30,Testes,Ovaries,Uterus,Penis,Environmental pressures and competition,Human intervention,Individual choices of organisms,,,,,,,,,,,,,,,
Science,Basic 7,Reproduction,Which of these is a method of seed dispersal by wind?,multiple_choice,c,Dandelion seeds have parachute-like structures that help them float in the wind.,medium,10,45,Coconut floating,Mango being eaten by an animal,Dandelion seeds blowing,Bean pods exploding,,,,,,,,,,,,,,,,,,
Science,Basic 7,Reproduction,What is the period of development of an embryo inside the mother's womb called?,multiple_choice,b,Gestation is the period from conception to birth.,easy,5,30,Fertilization,Gestation,Ovulation,Menstruation,Evolution,,,,,,,,,,,,,,,,,
Science,Basic 7,Reproduction,Which of the following is an organism that reproduces asexually by binary fission?,multiple_choice,d,Bacteria reproduce by binary fission, where one cell splits into two identical daughter cells.,medium,10,60,Yeast,Hydra,Earthworm,,,,,,,,,,,,,,,,,,
Science,Basic 7,Reproduction,What is the male reproductive cell in animals?,multiple_choice,a,Sperm is the male gamete.,easy,5,30,Sperm,Egg,Zygote,Pollen,,,,,,,,,,,,,,,,,,
Science,Basic 7,Reproduction,Which part of the flower produces pollen?,multiple_choice,b,The anther produces pollen.,easy,5,30,Ovary,Anther,Stigma,Petal,,,,,,,,,,,,,,,,,,
Science,Basic 7,Reproduction,What is the process where a single parent produces offspring that are genetically identical to itself?,multiple_choice,c,Asexual reproduction creates clones.,medium,10,45,Sexual reproduction,Fertilization,Asexual reproduction,Pollination,,,,,,,,,,,,,,,,,,
Science,Basic 7,Reproduction,The life cycle of a frog involves a larval stage that lives in water. What is this larval stage called?,multiple_choice,d,The larval stage of a frog is a tadpole.,easy,5,30,Caterpillar,Nymph,Maggot,Tadpole,,,,,,,,,,,,,,,,,,
Science,Basic 7,Reproduction,What is the main advantage of sexual reproduction over asexual reproduction?,multiple_choice,a,Sexual reproduction leads to genetic variation, which increases a species' adaptability.,medium,10,60,Genetic variation in offspring,Faster reproduction rate,Requires only one parent,Structures that appear in different species by chance,,,,,,,,,,,,,,,,,
Science,Basic 7,Reproduction,Which of the following is a viviparous animal (gives birth to live young)?,multiple_choice,c,Cows give birth to live calves.,easy,5,30,Chicken,Snake,Cow,Fish,,,,,,,,,,,,,,,,,,
Science,Basic 7,Reproduction,In plants, what is the structure that contains the embryo of a new plant?,multiple_choice,a,The seed contains the embryo and food reserves.,easy,5,30,Seed,Flower,Fruit,,,,,,,,,,,,,,,,,,
Science,Basic 7,Reproduction,What is the process of shedding an outer layer or cuticle by an insect during growth?,multiple_choice,b,Molting is common in insects as they grow through their life stages.,medium,10,45,Metamorphosis,Molting,Pupation,Hatching,,,,,,,,,,,,,,,,,,
Science,Basic 7,Reproduction,Which human reproductive organ produces eggs?,multiple_choice,d,The ovaries are the female reproductive organs that produce eggs.,easy,5,30,Testes,Uterus,Vagina,Ovaries,,,,,,,,,,,,,,,,,,
Science,Basic 7,Reproduction,What is the importance of seed dispersal for plants?,multiple_choice,a,Seed dispersal helps prevent overcrowding and competition for resources.,medium,10,60,Prevents overcrowding and reduces competition,Increases seed size,Ensures immediate germination,Reduces genetic variation,,,,,,,,,,,,,,,,,,
Science,Basic 7,Reproduction,Which animal undergoes incomplete metamorphosis (egg, nymph, adult)?,multiple_choice,c,Grasshoppers undergo incomplete metamorphosis.,medium,10,45,Butterfly,Moth,,,,,,,,,,,,,,,,,,
Science,Basic 7,Reproduction,What is the male gamete in flowering plants?,multiple_choice,b,Pollen contains the male gametes.,easy,5,30,Egg,Pollen,Ovule,Seed,,,,,,,,,,,,,,,,,,
Science,Basic 7,Reproduction,What is the fusion of male and female gametes called?,multiple_choice,d,Fertilization is the fusion of gametes.,easy,5,30,Pollination,Germination,Embryo development,Fertilization,,,,,,,,,,,,,,,,,,
Science,Basic 7,Reproduction,The development of a new plant from a part of a parent plant, such as a stem or leaf, is called?,multiple_choice,a,Vegetative propagation is a form of asexual reproduction in plants.,medium,10,60,Vegetative propagation,Sexual reproduction,,,,,,,,,,,,,,,,,,
Science,Basic 7,Reproduction,Which of the following is NOT a method of asexual reproduction?,multiple_choice,b,Pollination is part of sexual reproduction in plants.,medium,10,60,Budding,Pollination,Binary fission,Fragmentation,To absorb more sunlight,,,,,,,,,,,,,,,,,
Science,Grade 7,Energy and Its Forms,What are the three main types of rocks?,multiple_choice,b,The three main types of rocks are igneous sedimentary and metamorphic based on how they form.,medium,10,75,Hard soft smooth,Igneous sedimentary metamorphic,Big medium small,Light medium dark,,,,,,,,,,,,,,,,,,
Science,Grade 7,Energy and Its Forms,How do sedimentary rocks form?,multiple_choice,c,Sedimentary rocks form when layers of sediment are compressed and cemented together over time.,medium,10,90,From cooling magma,From heat and pressure,From layers of sediment being compressed,From volcanic eruptions,Their adaptation would be constant,They would not need to adapt,,,,,,,,,,,,,,,,
Science,Grade 7,Energy and Its Forms,What is a mineral?,multiple_choice,a,A mineral is a naturally occurring solid substance with a definite chemical composition and crystal structure.,hard,10,90,A naturally occurring solid with definite composition,Any rock found in nature,Only metals found underground,Liquid substances in rocks,Convergent structures,,,,,,,,,,,,,,,,,
Science,Grade 7,Energy and Its Forms,Which rock type forms from cooling magma?,multiple_choice,b,Igneous rocks form when molten magma or lava cools and solidifies.,medium,10,60,Sedimentary,Igneous,Metamorphic,Volcanic,To deter predators,,,,,,,,,,,,,,,,,
Science,Grade 7,Energy and Its Forms,What happens to rocks during the rock cycle?,multiple_choice,d,The rock cycle shows how rocks can change from one type to another through various geological processes.,medium,10,90,They disappear,They only get bigger,They only get smaller,They change from one type to another,,,,,,,,,,,,,,,,,,
